{"$schema":"https://json-schema.org/draft/2020-12/schema","title":"Type Moon World magic definition","type":"object","additionalProperties":false,"properties":{"id":{"$ref":"#/$defs/id"},"name_key":{"type":"string","maxLength":128},"category":{"$ref":"#/$defs/id"},"school":{"$ref":"#/$defs/id"},"mana_cost":{"type":"number","minimum":0},"cooldown_ticks":{"type":"integer","minimum":0},"learnable":{"type":"boolean"},"wheel_selectable":{"type":"boolean"},"crest_allowed":{"type":"boolean"},"npc_allowed":{"type":"boolean"},"knowledge_only":{"type":"boolean"},"npc_global_cooldown":{"type":"integer","minimum":0},"npc_cooldown":{"type":"integer","minimum":0},"required_attributes":{"type":"array","maxItems":32,"uniqueItems":true,"items":{"$ref":"#/$defs/id"}}},"$defs":{"id":{"type":"string","pattern":"^[a-z0-9_.-]+:[a-z0-9_./-]+$","maxLength":128}}}
