{
  "name_key": "magic.typemoonworld.engraved_worm_operation.name",
  "category": "typemoonworld:special",
  "school": "typemoonworld:none",
  "mana_cost": 8.0,
  "cooldown_ticks": 10,
  "learnable": true,
  "wheel_selectable": true,
  "crest_allowed": false,
  "npc_allowed": true,
  "knowledge_only": false
}
