{
  "name_key": "magic.typemoonworld.ubw_sword_control.name",
  "category": "typemoonworld:unlimited_blade_works",
  "school": "typemoonworld:none",
  "mana_cost": 30.0,
  "cooldown_ticks": 10,
  "learnable": true,
  "wheel_selectable": true,
  "crest_allowed": false,
  "npc_allowed": false,
  "knowledge_only": false
}
